{
  "pack_contract_version": "1.0",
  "role": "holdout",
  "catalog_id": "synthetic-catalog",
  "catalog_fingerprint": "81fd27ce3f79b9ff158f4364d24bfe48965101fdfec8b586179342f1ffd2020d",
  "split_id": "split-81fd27ce3f79b9ff158f",
  "split_fingerprint": "aac7e29bb84c8de91b51775bd7bc42b06af446a95fa944451f5dc903819a704b",
  "exemplar_ids": [
    "EX-03"
  ],
  "exemplars": [
    {
      "exemplar_id": "EX-03",
      "group_id": "GR-02",
      "source": {
        "title": "SYNTHETIC TEST CARD 3",
        "institution": "synthetic_fixture",
        "author_or_team": "test fixture only",
        "canonical_url": "https://example.invalid/synthetic/3",
        "provided_source_id": null,
        "source_label": null,
        "source_type": "official_platform",
        "authority_tier": "A",
        "authority_basis": "official_award",
        "recognition": "synthetic benchmark evidence only",
        "recognition_evidence": [
          "SYNTHETIC; NON-TEACHING-QUALITY-EVIDENCE"
        ],
        "retrieved_at": "2026-09-27T00:00:00Z",
        "visibility": "public",
        "source_identity_sha256": "27110b97597d4f3c5dc19529912c986f54154225177a1aff50b28513cdbee1cc"
      },
      "scope": {
        "education_level": "synthetic test fixture",
        "vocational_level": "synthetic test fixture",
        "domain": "synthetic test fixture",
        "course": "synthetic test fixture",
        "scope_mode": "course_specific",
        "topic": "synthetic test fixture",
        "learner_profile": "synthetic test fixture",
        "duration_minutes": 45,
        "teaching_context": "synthetic test fixture only"
      },
      "qualification": {
        "status": "QUALIFIED",
        "rationale": "Synthetic fixture for deterministic contract testing; no real teaching-quality claim."
      },
      "design_patterns": [
        "Synthetic abstract design pattern."
      ],
      "difficulty_breakthrough_patterns": [],
      "student_activity_patterns": [],
      "learning_evidence_patterns": [],
      "assessment_patterns": [],
      "differentiation_patterns": [],
      "reflection_patterns": [],
      "transferable_principles": [],
      "non_transferable_context": [],
      "do_not_copy": [
        "Synthetic test data; not source content."
      ]
    }
  ],
  "pack_fingerprint": "c12319c040a2d1f5cc833ba74aee3624dbf563272e481b32d83a747bc9290608"
}
